{"business_evaluation":false,"context_sha256":"d1dd0b02d9e77ea566e2d8b877d84d2af8db01a3716e4a5b6e341c58d372b57d","limitations":["not_business_evaluation","m5_review_dispatch_gate_not_implemented"],"missing_package_facts":[],"observations":[{"criterion_id":"criterion-001","evidence_fact_ids":["synthetic-evidence-fact-001"],"reason":"The trusted closed synthetic package contains one evidence fact stating the fixture records one passing assertion, which directly supports criterion-001's requirement that the fixture contains one asserted expected result.","status":"contract_shape_supported"}],"output_type":"reviewer_contract_smoke","package_id":"475e9f75-a6ff-56db-b5f8-e074ff28155f","package_sha256":"3bd1dbb4f2803ea1af8fffac46080928c9603d803b8f3c0dc57c3c60234cb565","reviewer_mode":"contract_smoke","rubric_version":"synthetic-rubric-v1","verified_claim_created":false}
