{"business_evaluation":false,"context_sha256":"c017766f0f9bcde93beb1a392a946ddb354a67c8740a4e825c5c75718cda6a7d","limitations":["not_business_evaluation","m5_review_dispatch_gate_not_implemented"],"missing_package_facts":[],"observations":[{"criterion_id":"criterion-001","evidence_fact_ids":["synthetic-evidence-fact-001"],"reason":"The trusted closed synthetic package contains one evidence fact stating the fixture records one passing assertion, which directly supports criterion-001's requirement that the fixture contains one asserted expected result.","status":"contract_shape_supported"}],"output_type":"reviewer_contract_smoke","package_id":"2add7f44-0300-528b-aafa-2f0b1171ab12","package_sha256":"f1b3996543001df8cd3dd5c9eccd7573070ce7cd5cca031ebb245d9b005a4162","reviewer_mode":"contract_smoke","rubric_version":"synthetic-rubric-v1","verified_claim_created":false}
